{"proposal_id":"notion-proposal-00000001","schema_version":"2.0.0","integration_mode":"simulated","simulation_id":"sim-00000001","submitted_at":"2026-08-19T12:00:00Z","intent":"approve","expected_revision":1,"actor":{"actor_id":"reviewer-sim","role":"reviewer"},"correlation_id":"corr-00000001","idempotency_key":"idem-00000001","target":{"tenant_id":"tenant-sim","project_id":"project-sim","run_id":"run-00000001","step_id":"4a"}}
